{"$schema":"https://json-schema.org/draft/2020-12/schema","title":"Miraaj Style Config","type":"object","required":["id","typography","colors","captions","spacing","radius","animation_speed","safe_area"],"properties":{"id":{"type":"string","minLength":1},"typography":{"type":"object","required":["family","weights"],"properties":{"family":{"type":"string"},"weights":{"type":"array","items":{"type":"integer","minimum":100,"maximum":900}}},"additionalProperties":false},"colors":{"type":"object","additionalProperties":{"type":"string","pattern":"^#[0-9a-fA-F]{6}$"}},"captions":{"type":"object","required":["font_size","highlight_color","position"],"properties":{"font_size":{"type":"number","exclusiveMinimum":0},"highlight_color":{"type":"string"},"position":{"enum":["top","center","bottom"]}},"additionalProperties":false},"spacing":{"type":"object","additionalProperties":{"type":"number","minimum":0}},"radius":{"type":"number","minimum":0},"shadow":{"type":"string"},"animation_speed":{"type":"number","exclusiveMinimum":0},"transitions":{"type":"object"},"talking_head":{"type":"object"},"visual_density":{"enum":["sparse","balanced","dense"]},"safe_area":{"type":"object","required":["top","bottom","horizontal"],"properties":{"top":{"type":"number","minimum":0},"bottom":{"type":"number","minimum":0},"horizontal":{"type":"number","minimum":0}},"additionalProperties":false}},"additionalProperties":false}
