{"id":"modern_creator_v1","typography":{"family":"Inter, Arial, sans-serif","weights":[400,500,600,700,800]},"colors":{"background":"#0b0d10","foreground":"#f3f4f6","accent":"#c4b5fd","muted":"#8b8d98","highlight":"#a78bfa"},"captions":{"font_size":64,"highlight_color":"#c4b5fd","position":"bottom"},"spacing":{"safe_horizontal":72,"caption_bottom":250,"scene_gap":24},"radius":28,"shadow":"0 24px 80px rgba(0,0,0,.35)","animation_speed":1,"transitions":{"default":"cut","duration_frames":12},"talking_head":{"scale":1.08,"corner_radius":28,"background":"blurred"},"visual_density":"balanced","safe_area":{"top":160,"bottom":260,"horizontal":72}}
